Company,Priority,Target Organization,Opportunity Signal,Revenue Motion,Contact Path,First Ask,Source URL,Status
Reparel,1,First Nations Distribution LLC,HHS BPA for miscellaneous medical and rehabilitation supplies,Sell to Award Recipient; Channel / Distributor Motion,"Government Contracts Manager; Medical Supply Category Manager; Clinical Supply Manager; Procurement Specialist","Can Reparel be evaluated as a recovery sleeve or orthotic-adjacent SKU for rehab supply ordering paths?",https://www.usaspending.gov/award/75H71025P00458,Validate distributor fit
Reparel,2,Performance Health Supply LLC,HHS BPA for miscellaneous medical and rehabilitation supplies,Sell to Award Recipient; Channel / Distributor Motion,"Rehab Supply Category Manager; DME/Orthotics Product Manager; Government Sales Lead; Clinical Supply Buyer","What is the supplier onboarding route for products that fit public-sector rehab and recovery supply categories?",https://www.usaspending.gov/award/75H71025P00547,Validate supplier onboarding
Reparel,3,National Environmental Inc.,HHS physical rehabilitation BPA for direct patient care supplies,Sell to Award Recipient; Sell to Agency,"Government Contracts Manager; Physical Therapy Supply Buyer; Rehab Services Director; Clinical Supply Manager","Does the physical rehabilitation BPA include patient recovery sleeves, brace undersleeves, or related PT support supplies?",https://www.usaspending.gov/award/75H71025P01050,Confirm ordering office
Reparel,4,Apex Integrated Distribution Inc. / Department of Veterans Affairs,VA purchase activity for physical therapy supplies,Sell to Agency; Channel / Distributor Motion,"VA Prosthetics Representative; VA Physical Therapy Supply Buyer; Procurement Specialist; Clinical Supply Manager","Which VA procurement path handles physical therapy, orthotics, and recovery support supplies?",https://www.usaspending.gov/award/36C24W25P0146,Use as VA market-map signal
Reparel,5,Footmaxx of Virginia Inc. / Department of Defense,DOD orthotic supplies award,Sell to Agency; Channel / Distributor Motion,"DOD Medical Supply Buyer; Orthotics Product Manager; Government Contracts Manager; Procurement Specialist","Which military medical supply vehicle or distributor channel handles orthotic-adjacent recovery products?",https://www.usaspending.gov/award/HT009024FG0310039,Use as DOD market-map signal
